textID,pre_formatted,match,post_formatted,surface,inverse,contracted,uniqueID,batch
240398,"And what we see right now, as far as its relationship to the military and to the illegal government, is a transition relationship. They have one priority. They want to get 15,000 troops on the ground, which is the right priority. But I think everybody should kind of back off a little bit and ",[everybody should] not be quite so suspicious and distrustful of what they see,. President Aristide is going back. ,nobody should be quite so suspicious and distrustful of what they see,not all should be quite so suspicious and distrustful of what they see,0,265,31
243298,"What would you tell them about how it feels to be you, dealing with them? 
CEDRIC JENNINGS: Dealing with them? 
MICHEL McQUEEN: Mm-hmm. 
CEDRIC JENNINGS: Well, that ",everybody is not perfect,", and everybody does not know everything. So-
MICHEL McQUEEN: Is this the first time in your life that you haven't been at the very top, top, top? ",nobody is perfect,not all are perfect,0,266,32
243298,"What would you tell them about how it feels to be you, dealing with them? 
CEDRIC JENNINGS: Dealing with them? 
MICHEL McQUEEN: Mm-hmm. 
CEDRIC JENNINGS: Well, that everybody is not perfect, and ",everybody does not know everything,". So- 
MICHEL McQUEEN: Is this the first time in your life that you haven't been at the very top, top, top? ",nobody knows everything,not all know everything,0,267,33
221273,"M.D., Pediatrician: I don't think any of these mothers are at fault. I think this is a failure of the health care delivery system. 
LYNN SHERR: voice-over She says most problems can be correct, but in rare cases, nursing is just not possible. 
Dr. MARIANNE KNEIFERT: ",Every breast just does not work,. I have lots of personal observations and data and case reports to confirm that. ,none just work,not all just work,0,268,34
230646,"Absolutely none. 
LARRY KING: Why not? 
crosstalk 
MICHAEL LANDON: It doesn't bother me if a reviewer doesn't like it because he's got his opinion. I made it because I like it and I know that ",everything I make is not going to be everybody's cup of tea,". But, I mean, if something I've done does badly, numbers-wise, as far as the audience is concerned, it's millions of people who have seen something that I think's beautiful. ",nothing (that I make) is going to be everybody's cup of tea,not all things (that I make) are going to be everybody's cup of tea,0,269,35
230652,"Sgt. LEONARD ROSS: Well, the concept of all of us being together, and the esprit de corps that the department boasts itself on and was born with, helped formulate it was, is that everybody is equal. And that is not true. And I want to clarify that, it is not the union per se. Because ",everybody in the union does not view these same things,". But it- historically, for 72 years the directors of that organization, the Police Protective League, have failed to provide or support one single issue that would impact minority issues. ",nobody (in the union) views these same things,not all (in the union) view these same things,0,270,36
231591,"HOWARD KURTZ: At the risk of suggesting that this is not, perhaps, one of the great technological breakthroughs of the late 20th century, like, say, the microwave oven, the level of hype here has been incredible. I mean buying up 1.5 million copies of the London Sunday Times and giving them out for free? The press has- there's this fascination with high-tech computer subjects. We sometimes forget that ",everybody in the world is not on-line,", is not going to go out and buy Windows. @ @ @ @ @ @ @ @ @ @, what does this tell us about the journalistic mind set, this hype?",nobody (in the world) is on-line,not all (in the world) are on-line,0,271,37
231591,"HOWARD KURTZ: At the risk of suggesting that this is not, perhaps, one of the great technological breakthroughs of the late 20th century, like, say, the microwave oven, the level of hype here has been incredible. I mean buying up 1.5 million copies of the London Sunday Times and giving them out for free? The press has- there's this fascination with high-tech computer subjects. We sometimes forget that everybody in the world is not on-line, ",[everybody in the world] is not going to go out and buy Windows,". @ @ @ @ @ @ @ @ @ @, what does this tell us about the journalistic mind set, this hype? ",nobody (in the world) is going to go out and buy Windows,not all (in the world) are going to go out and buy Windows,0,272,38
231882,"Now it got even worse on -- on ""MacNeil/Lehrer"" last night. If you think that I'm making all this up -- see, this is a passionate thing for me because for seven years I've been trying to point this out about liberals; that they condescend toward average people. They think they're better than everybody else. The best and the brightest -- it's them, and ",everybody else is not the best and brightest,. You're not capable. ,nobody else is the best and brightest,not all else are the best and brightest,0,273,39
232911," @!SMITH: @(Voiceover) But this is a special school, with special kids who have special problems .. 
@(Footage-of-Sally-S) 
@!Ms-SALLY-@: So let's find your teacher. You're with Marie. 
@ ( Footage-of-student 
Ms. @!SMITH: @(Voiceover) ",Every child that we have here can not make it in the regular school,", no matter how much tutoring help that they @ @ @ @ @ @ @ @ @ @ 
Ms. @!SMITH: How are you, Danielle? ",none (that we have here) can make it in the regular school,not all (that we have here) can make it in the regular school,0,274,40
223849,"If you're performing a duty for the federal government or the state government, and the government is telling you that you must function in a particular language, you can not file, for instance, reports on malpractice suits @ @ @ @ @ @ @ @ @ @. 
GRETA VAN SUSTEREN: Georgina, what about it, though? I mean, this is- We talked about free speech. You know, ",every amendment to the Constitution is not an unlimited amendment,. There are certain reasonable restrictions. ,none are unlimited amendments,not all are unlimited amendments,0,275,41
230059,"My forgiveness of -- of -- my forgiveness you have, and always will. @ @ @ @ @ @ @ @ @ @ help you to live. Live your life the best that you can. ",Every boy that you meet is not a spiritual man,. My forgiveness you have because at one time I needed yours. ,none (that you meet) are spiritual men,not all (that you meet) are spiritual men,0,276,42
233570,"They called me up and said, 'You want to do a family show? We want you to do a family show.' 
YOLANDA GASKINS: Now your show- In your show, you are a southern guy, but @ @ @ @ @ @ @ @ @ @, and your families not southern. ",Everybody's not walking around with the same accent,". 
JEFF FOXWORTHY: No. ",nobody is walking around with the same accent,not all are walking around with the same accent,0,277,43
248086,"Well everything involving government action does become a concern of Congress at one point or another and there will be congressional hearings. And the issue, of course, as you suggested is not just the performance of ValuJet which did have more problems than other discount airlines did, but the performance of the FAA, the Federal Aviation Administration. There was an internal @ @ @ @ @ @ @ @ @ @ were not accurately monitoring ValuJet's safety problems. And I suppose when Congress looks at this, they will be looking for villains and they will easily find villains in the aviation industry where ",everything is not always perfect, and where things don't always function as they should function. I wonder though whether Congress will now repeat in the course of this all the speeches that they love to make about getting the regulators off our backs. ,nothing is always perfect,not all things are always perfect,0,278,44
223484,"But at the trial, he will be testifying, and so will his psychiatric doctors. 
JAY SCHADLER: Clearly, Luke felt that he was a picked-on, ridiculed kid. @ @ @ @ @ @ @ @ @ @ defense on that, are you? 
LESLIE ROUSSELL, Luke's Attorney: ",Everybody's psyche is not equal,. What breaks you down may be different than what breaks me down. ,nobody's psyche is equal,not all people's psyches are equal,0,279,45
227586," @!IMUS: No. 
@!KING: I Man, you don't care. You'd want to be heard by every American, tomorrow? 
@!IMUS: Well, I mean, I -- ",every American's not going to listen,". But, I mean, Howard @ @ @ @ @ @ @ @ @ @",none are going to listen,not all are going to listen,0,280,46
227987," @!SPITZER: The statistic on the screen during the break was 65 percent of murders are solved. That means 35 percent are not solved. 
@!HAYES: OK. 
@!SPITZER: ",Every crime can not be solved beyond proof beyond a reasonable doubt,". If the police had come out and pointed the finger at the parents and didn't have the evidence to substantiate it, we would all say that was wrong. ",none can be solved beyond proof beyond a reasonable doubt,not all can be solved beyond proof beyond a reasonable doubt,0,281,47
230774,"Do you believe -- do you, Senator Thompson, believe that everyone does it? Republican and Democrats did it to the same degree? 
@!SEN-THOMPSON: Tim, if you're talking about soft money, which is legal, and the pursuit of soft money, which I think has gotten totally out of hand, something we ought to do something about, yeah, everybody does that. But if you're talking about a systematic effort to bring in illegal money into a campaign, to bring in foreign money, to use the White House in such a way that it's been used, no, ",everybody does not do that,". 
@!MR-RUSSERT: Lisa, we have one minute. ",nobody does that,not all do that,0,282,48
234031," @!SPRINGER: You say -- What did you say about the rap music? You talk. 
@!Ms-HYMAN: I said rap music -- if you're listening to rap music, do you think that's positive: popping caps in people's asses, calling people bitches, raping @ @ @ @ @ @ @ @ @ @ 
@!DE-DE: ",Every rap is not about that,". 
Unidentified Man 2: For the people behind GWAR: I'm not sure what your names are, but you said that you get ( censored ) for HIV before everybody you have sex with. ",none are about that,not all are about that,0,283,49
243887,"TED KOPPEL: Which, in itself, Leo, is sort of a suspicious piece of evidence in a curious way. In other words, first of all, OJ Simpson has denied ever wearing such ""ugly assed shoes"", as he put it, ever owning such shoes. Clearly he did own them. Secondly, everything connected to this murder is missing and ",[everything connected to this murder] has not been found,. The clothing @ @ @ @ @ @ @ @ @ @ found. ,nothing (connected to this murder) has been found,not all things (connected to this murder) have been found,0,284,50
227621,"""Lucky me, I got a hold of Richard Gooding Saturday night -- gave up my Saturday night to get a hold of him, and he told me, geez, I didn't @ @ @ @ @ @ @ @ @ @, number one. 
@!KING: Who is Richard Gooding? 
@!LUQUE: He is quoted in their most recent story. And number two, he told me that almost ",everything that was reported was not true,. So I have reason to doubt Mr. Isikoff's communication with people. ,nothing (that was reported) was true,not all things (that were reported) were true,0,285,51
227694," @!MCCURRY: I have no way of knowing, but that certainly seems a possibility. 
@!QUESTION: Can you categorically deny that no incident ever took place where any staff member discovered the president in a room with Monica Lewinsky? 
@!MCCURRY: Well, the president says that has not happened. ",Everyone that we have checked with is not aware of any such report,", or anything coming to the attention of @ @ @ @ @ @ @ @ @ @ I'm aware of. I'm not aware that that's ever been reported by the Secret Service to anyone responsible here at the staff?",no one (that we have checked with) is aware of any such report,not all (that we have checked with) are aware of any such report,0,286,52
228997,"I want to begin with Congressman McCollum. As a member of the Judiciary Committee, CBS News has it from two sources, The New York Times has it from two sources, the Associated Press has it from three sources, The Washington Post now with the story this morning, that whatever he does in the end, it seems pretty clear the president's friends are putting out the story that he is thinking about changing his story about Monica Lewinsky, a woman he has denied having a relationship with. Congressman McCollum, if he does change his story, does that make impeachment more or less likely? 
Representative BILL McCOLLUM ( Republican, Florida; Judiciary @ @ @ @ @ @ @ @ @ @ be put in context -- context, first of all, that almost ",everyone I know does not want to see the president of the United States impeached,", if at all possible. We all think that that's a bad thing to have happen, and we hope that when the sun sets on Ken Starr's investigation, he goes before the television microphones and says, 'I don't have a case, I don't have a report to send up to Congress.' ",no one (that I know) wants to see the president of the United States impeached,not all (that I know) want to see the president of the United States impeached,0,287,53
234666,And people with children with Tourette's keep indicating to me that a lot of the behavior that we're seeing is not normally associated with Tourette's. It's @ @ @ @ @ @ @ @ @ @ a lot of the questions coming up have to que -- they're questioning is the medicine that Robbie is taking properly -- properly aligned or -- or diagnosed. And I guess that's -- kind of summarizes it. We're just really concerned that ,everything is not the way it should be,. It's a behavior problem. ,nothing is the way it should be,not all things are the way they should be,0,288,54
236751,"And I was just horrified 
@!ADAMS Was this sort of a -- what happens physically at that moment when you have this ... 
GORKA: It was a shock. I felt like, well, I wouldn't be surprised if the building went away or the earth opened up and ",everything else that I had depended on was not there anymore,. I felt like anything could happen at that point,nothing else (that I had depended on) was there anymore,not all things else (that I had depended on) were there anymore,0,289,55
241295,"I mean, Orrin Hatch is right, and Pat Leahy is, that they're -- quite frankly, they're not coming to a vote. 
@!KATE-O'BEIRNE: I agree with Mark that Congress has exacerbated the problem by federalizing crimes on their law and order kick, and that has contributed to more federal cases, before the federal bench; however, it would be perfectly appropriate for Justice Rehnquist not to be criticizing Congress, except on that ground, because I agree, they shouldn't be federalizing crimes, many more crimes, but instead to talk to his fellow lifetime appointees and say let's show some self-restraint. @ @ @ @ @ @ @ @ @ @ as the court of first resort if you disagree with the commencement speech, you don't go to your state Department of Education director; you don't go to the principal or school board; you go straight to federal court. And if federal judges showed some restraint and weren't hearing all of those cases -- every court -- ",every case is not Brown vs. Board of Education --,"
@!JIM-LEHRER: Right. ",none are Brown vs. Board of Education --,not all are Brown vs. Board of Education --,0,290,56
245697,"Do we fail to see how often that that doesn't translate to voting for a Democrat, even if you answer to the pollster: yeah, I think the Democrats do this and this in this and this -- that it doesn't necessarily mean that you're going to go in in November and pull for a Democrat? 
HORWICH: Absolutely. I think that when you see those national polls, what it doesn't necessarily show is that people generally like their incumbent. And they think that everybody else in Congress is crooked or ",[everybody else in Congress is] not doing a good job,. But they like the person who represents them. ,nobody else (in Congress) is doing a good job,not all else (in Congress) are doing a good job,0,291,57
221323," @!BARBARA-WALTERS: You are about to meet one of the most beautiful women in the world. She is a top fashion model, but she has a dark and devastating secret to reveal. We all know that fashion magazines are full of fantasy and illusion, but you might be surprised to see how far the pictures can be from the truth. Perri Peltz has the inside story of woman who looks ideal ... 
@(Voiceover) ... but ",everything is not what it seems,". 
@(Magazines) 
@!PERRI-PELTZ-report: @(Voiceover) Her face has graced the covers of dozens of fashion magazines. ",nothing is what it seems,not all things are what they seem,0,292,58
224382,"What's your response to that criticism? 
@!Mr-SHOELS: Well, my response to that is that, you know, we was -- you know, we was part of that community. We felt very highly. Now all of Littleton -- I mean, all of that community is not in that s -- sickly @ @ @ @ @ @ @ @ @ @ the reason I say that is because ",everyone did not vandalize our house three times before the shooting,". I mean, you know, under these circumstances, I mean, you know, it's kind of hard to be -- you know, feel like you're part of a community and, you know, these type things are happening. ",no one vandalized our house three times before the shooting,not all vandalized our house three times before the shooting,0,293,59
229767,"He believed in competence, that sort of thing. And then Lee Atwater went after him, and he became a liberal, liberal, liberal in the minds of Americans. So I -- you know, it's not -- you know, it doesn't follow. I mean, ",everything is not the same as everything else by any stretch of the imagination,", but I would certainly think that that -- that if I were running the Gore campaign, I would be wanting to try that one out. 
@!CRIER: Andy, any sense at all -- we 've got about 30 seconds -- how this ""compassionate conservatism"" is playing?",nothing is the same as everything else by any stretch of the imagination,not all things are the same as everything else by any stretch of the imagination,0,294,60
230757,"The one in 1998 had similar ineptitude, and this one -- most of the stories have been about his advisors. I mean, Naomi Wolf is the least of it, except for the price that they paid for her. But, you know, one tobacco advisor, another who has left Congress in a cloud. I mean, it seems like everything is about his advisors and ",[everything is] not [about] Al Gore,". 
@!MR-RUSSERT: John McCain has a temper, Doris Kearns Goodwin? ",nothing is about Al Gore,not all things are about Al Gore,0,295,61
231237," @!Mr-FLORIO: Mm-hmm. Right. 
@!PRESSMAN: ... and denied -- said that he never advocated privatizing Social Security. 
@!Mr-FLORIO: Well, he -- he has said that he wants to put everything on the table, and that's an important issue because ",everything should not be on the table,. This should be a universal system. ,nothing should be on the table,not all things should be on the table,0,296,62
241699,"And it has been reported all over the world as a landmark -- why is it landmark, because six people in Florida made this decision? 
@!CLARK-FRESHMAN: Well, it is going to cost potentially, billions and billions of dollars. In most cases, you would have one or two plaintiffs, perhaps a group of plaintiffs bringing the case and then if there was a loss, it was what their particular medical damages were, their loss of income. What this has done is to say if this is upheld on appeal or if this settles, which I think is quite likely, that ",everyone in the state of Florida up until now who has been damaged will not have to hire their own expert witnesses,", will not have to go mano-a-mano against the tobacco companies and prove that smoking causes cancer. All they'll have to do is show what their particular medical expenses and out-of-pocket @ @ @ @ @ @ @ @ @ @ floodgates here in Miami.",no one (in the state of Florida up until now who has been damaged) will have to hire their own expert witnesses,not all (in the state of Florida up until now who have been damaged) will have to hire their own expert witnesses,0,297,63
241699,"And it has been reported all over the world as a landmark -- why is it landmark, because six people in Florida made this decision? 
@!CLARK-FRESHMAN: Well, it is going to cost potentially, billions and billions of dollars. In most cases, you would have one or two plaintiffs, perhaps a group of plaintiffs bringing the case and then if there was a loss, it was what their particular medical damages were, their loss of income. What this has done is to say if this is upheld on appeal or if this settles, which I think is quite likely, that everyone in the state of Florida up until now who has been damaged will not have to hire their own expert witnesses, ",[everyone in the state of Florida up until now who has been damaged] will not have to go mano-a-mano against the tobacco companies and prove that smoking causes cancer,. All they'll have to do is show what their particular medical expenses and out- of-pocket @ @ @ @ @ @ @ @ @ @ floodgates here in Miami. ,no one (in the state of Florida up until now who has been damaged) will have to go mano-a-mano against the tobacco companies and prove that smoking causes cancer,not all (in the state of Florida up until now who have been damaged) will have to go mano-a-mano against the tobacco companies and prove that smoking causes cancer,0,298,64
244588,"Right now prosecutors in L.A. are trying to figure out how many people were framed or beaten or shot, how many people have been sent to jail wrongly, how many laws the police broke to fight a nasty @ @ @ @ @ @ @ @ @ @ And for the rest of us this question, not could it happen anywhere, but is it happening to one degree or another everywhere? We begin in Los Angeles tonight with ABC's Judy Muller. 
JUDY MULLER, ABC News: ( voice-over ) At today's police academy graduation in Los Angeles, some words of warning from the chief. 
Chief BERNARD PARKS, Los Angeles Police Department: ","Every officer that we know of that has gone bad in the past did not start off walking into a bank and robbing it of $720,000 or going into a property room and stealing six pounds of cocaine",. They started off with small things. ,"none (that we know of that have gone bad in the past) started off walking into a bank and robbing it of $720,000 or going into a property room and stealing six pounds of cocaine","not all (that we know of that have gone bad in the past) started off walking into a bank and robbing it of $720,000 or going into a property room and stealing six pounds of cocaine",0,299,65
54263," @!MARK-PHILLIPS-repo: @(Voiceover) Surely, if anyone can teach us how to live in a sex-obsessed society, it's the French. While they don't actually claim to have invented sex here, they do like to think they know more about it than we do. Well, maybe. But in the land that invented the French kiss, ",everything is not always what it seems,". Some of the French, in fact, have forgotten how to be lovers. ",nothing is always what it seems,not all things are always what they seem,0,300,66
57279,"But on the whole, they seem to have represented extremes, because when Jefferson took office -- and one would hope that this might be a model to whoever takes office on January 20 -- he made an absolutely wonderful inaugural address, in which he said, 'Look' -- the words are his -- 'we are all Republicans, we are all Federalists,' by which he meant that the Republicans didn't really want to pull apart the union, and the Federalists didn't really want to reinstall the monarchy. He said, 'We are one people. We have a wonderful future ahead of us, a great continent. @ @ @ @ @ @ @ @ @ @ but ",every difference of opinion is not a difference of principle,. We have called brethren by different names. ,none are a difference of principle,not all are a difference of principle,0,301,67
74199,"Instead, he badmouths people, insults people, and has a crass attitude toward anyone who has got problems, or is weaker than he is as a governor and a wrestler. And I do @ @ @ @ @ @ @ @ @ @ money from it. I think it's unethical. 
@!MAN: ",Everything I've heard him say has not been ... Good,", you know, hasn't been right. 
@!MAN: I personally don't think he's taken much time to be governor. ",nothing (that I've heard him say) has been good,not all things (that I've heard him say) have been good,0,302,68
74199,"Instead, he badmouths people, insults people, and has a crass attitude toward anyone who has got problems, or is weaker than he is as a governor and a wrestler. And I do @ @ @ @ @ @ @ @ @ @ money from it. I think it's unethical. 
@!MAN: Everything I've heard him say has not been ... good, you know, ",[everything I've heard him say] hasn't been right,". 
@!MAN: I personally don't think he's taken much time to be governor. ",nothing (that I've heard him say) has been right,not all things (that I've heard him say) have been right,0,303,69
135996," @!Mr-HICKEY: Sure. I remember my car running out of gas when I was a student. I -- you know, we've heard anecdotal stories of people putting their college tuition money in, taking those kinds of risks here. I think it's -- if it was true that ",everyone was not taking risks," and was just putting a little bit of money into the stock market, then everything would @ @ @ @ @ @ @ @ @ @ the case. 
McCHESNEY: Do you think that seeing the air let of tires of some of the -- I think the most vulnerable stocks, as I understand it, in this situation are the what we call business-to-consumer Internet commerce stocks, selling everything from cars to kitchen sinks on the Internet.",no one was taking risks,not all were taking risks,0,304,70
