textID,pre_formatted,match,post_formatted,surface,inverse,contracted,uniqueID,batch
4027009,"We don't approve of the video, we have never approved of the video, and it's been very bad for us as well. 
@!MARTIN: What do you think should happen now, Anuse? 
@!Mr-VESSEL: I can really understand why a lot of the black students are very unhappy, I really understand that, but I think it's going to be a long process, it won't happen in a day, but people should start talking and taking hands and say now we know this happened but everyone on campus isn't a racist. Everyone doesn't hate black people, ",every black person doesn't hate white people,. @ @ @ @ @ @ @ @ @ @ not let anything like this happen again and move forward from here because it's not a very good thing. ,none hate white people,not all hate white people,1,180,24
4028368,"""Lady in the Water,"" right? 
@!HOLLOWAY: ""Lady in the Water,"" yeah. 
@!PESCA: I mean, it's a decent movie, if the ending worked. No one thought the ending worked, so ",everyone didn't like it,". Don't give away the ending, but just tell us, does the ending work in ""The Happening ""? ",no one liked it,not all liked it,1,181,25
4030227,"Ok? 2.9 times as many votes were found @ @ @ @ @ @ @ @ @ @ up there. It's very strange. 
O'REILLY: ",Everything doesn't add up,. Not something. ,nothing adds up,not all things add up,1,182,26
4030227,"It's very strange. 
O'REILLY: Everything doesn't add up. Not something. ",Everything doesn't add up,. You are not finding any votes for the Republican guy? ,nothing adds up,not all things add up,1,183,27
4030288,"And my question is isn't it a problem when unions collude with employers instead of solely advocating for workers like me? 
@!Mr-STERN: I think what we need to appreciate is that it's enormously important in the 21st century to try to build an America that works for everyone. And working with employers like @ @ @ @ @ @ @ @ @ @ are in California, like health-care workers do in New York where we have huge partnerships with our employer, you know, I think we need a 21st-century version of unions where people try to work together. And I appreciate that ",everyone doesn't necessarily see that from the same point of view,. But I think that 20th century conflictual way did not create America that works. ,no one necessarily sees that from the same point of view,not all necessarily see that from the same point of view,1,184,28
4031229,"And you can see increasingly that that is where the President is putting all of his political capital and all of his cards. And that's where you have ... 
@!GEORGE-STEPHANOPOU# @(Off-camera) They won't say so, but they've pretty much given up on cap in trade? 
@!RUTH-MARCUS-@1 "" WAS# For this year, yeah. And so you'll probably see a budget resolution that provides for the stick, the potential stick of doing health care reform, with a majority vote, if ","everybody hasn't sort of come around the table, held hands and agreed on this complicated thing by September or so",". 
@!GEORGE-WILL-@1-ABC# @(Off-camera) Cap in trade is an interesting thing to give up because it's $659 billion over the next ten years in their extremely fictitious budget. ","nobody has sort of come around the table, held hands and agreed on this complicated thing by September or so","not all have sort of come around the table, held hands and agreed on this complicated thing by September or so",1,185,29
4031317,"That was the tenor of the time. There was more talk about it than people realize. Again, I thought that what was happening to us there in San Francisco was the whole world, and it wasn't. I had to learn later that ",everybody didn't feel that way,". 
@!LAUER: What did you think would happen if you were successful? ",nobody felt that way,not all felt that way,1,186,30
4031489,"How do you respond to that? 
@!DRISCOLL: That's the pajama hadeen ( ph ). There are always haters. And ",everything you read on the Internet isn't true,". My real goal is to after young guys in their 20s who are singles and sometimes ladies that are in their 60s that live in the woods don't exactly get what I'm trying to do, and that's not a shock. ",nothing (that you read on the Internet) is true,not all things (that you read on the Internet) are true,1,187,31
4072071," @!STEVE-HARVEY-@1-AB# @(Off-camera) Is that amazing? It's amazing. 
@!DIANE-SAWYER-@1-AB# @(Off-camera) Amazing, ""Act Like A Lady, Think Like A Man."" 
@!STEVE-HARVEY-@1-AB# @(Off-camera) And ",everybody doesn't have it yet,". 
@!DIANE-SAWYER-@1-AB# @(Off-camera) That's right. ",nobody has it yet,not all have it yet,1,188,32
4072192,"And, Laura, Patrick stood up to cancer very publicly in September of 2008, appearing on an unprecedented fundraising program on all three major broadcast networks. Watch. 
@(BEGIN-VIDEO-CLIP) 
@!SWAYZE: I keep dreaming of a future -- a future with a long and healthy life, a life not lived in the shadow of cancer, but in the light. I dream that everyone diagnosed will be fortunate enough to have hope, that ",every human being lost to cancer isn't gone,", but is standing here with us tonight. Tonight, I stand here, another individual living with cancer, who asks that we not wait any longer. ",none (that are lost to cancer) are gone,not all (that are lost to cancer) are gone,1,189,33
4072314,"They took in some family members. The younger crowd comes in and they don't maintain as well. And so you've got an elderly person there, @ @ @ @ @ @ @ @ @ @ n't quite keep up the neighborhood. Then you've got the younger folks trying to move in, wanting to make a difference, and they're buying the properties, along with the investors, thinking they can make a difference, and you know, you have your good investors, you have your bad investors, and ",everyone isn't in it for home ownership,. Some want decent rental housing. ,no one is in it for home ownership,not all are in it for home ownership,1,190,34
4072339,"It's - it works very, very well. 
@!CYNTHIA-MCFADDEN-@# @(Voiceover) Most everything seems to be grips of the mill. She says she makes no effort to separate the brand from herself. 
@!CYNTHIA-MCFADDEN-@# @(Off-camera) Wow, so there's not just a little piece that's still yours that ",everybody else doesn't get,"? 
@!MARTHA-STEWART-@1-# @(Voiceover) Oh, there are pieces, but there are also concealed at work and they are concealed at home. ",nobody else gets,not all else get,1,191,35
4072496," @!GROSS: Did you usually read your father's novels? 
Mr. DUNNE: From the - you know, his first one, from - he has always, you know, printed it out and given me the, you know, the looseleaf pages of every single one, and you know, I have given him some real bum advice. 
@!GROSS: Really? 
Mr. DUNNE: Oh yeah, because, you know, his - as a reader, it's his - his journalism is something that's - you know, as a reader I'm just more sort of taken with, and his novels are, particularly ""Two Mrs. Grenvilles"" and some afterwards, I remember reading ""People Like Us,"" and Tom Wolfe's book had just come @ @ @ @ @ @ @ @ @ @ God, this is in the same terrain, and they're going to, you know, criticize you, and it's going to be - and you're taking on these people, and it's - ",everything I said couldn't have been more wrong,". It was his biggest seller, and I worried him about nothing. ",nothing (that I said) could have been more wrong,not all things (that I said) could have been more wrong,1,192,36
4072629,"Yeah. Yeah. 
@!MATTHEWS: OK. 
@!Mr-DUFFY: Sure, as long as ",everyone's competing memoirs don't open up all the debates we've been talking about,. And they are all coming out @ @ @ @ @ @ @ @ @ @. ,no one's competing memoirs open up all the debates we've been talking about,not all people's competing memoirs open up all the debates we've been talking about,1,193,37
4072764," @!ROVE: I'm confident that Dana Milbank would never say that Ted Kennedy lied to the American people when he said Saddam had WMD, or that John Kerry lied, or Hillary Clinton, or Al Gore or Bill Clinton, or Bob Graham, or Jay Rockefeller, or Jane Harmon, or a whole -- Barbara Boxer with 67 Democrats stood up on the floor of the Senate or House and said- 
O'REILLY: And you know each one of them. 
@!ROVE: -- Saddam had weapons of mass destruction. They were @ @ @ @ @ @ @ @ @ @ All right, but here's what you don't understand. Dana Milbank knows. ",Everybody else doesn't know,", but he knows. Okay, now Tom Hanks. ",nobody else knows,not all else know,1,194,38
4072813," @!CYNTHIA-MCFADDEN-@# @(Voiceover) But as the bulk of the ministry's money is spent on television and other media, many are left wondering if the real business of the ministry is promoting Joyce Meyer. 
@!JOYCE-MEYER-@1TELE# There's no way that I would be as widely accepted in the world as I am if God was not giving me favor with people. No way. ",Everybody doesn't have to like me,. Just - pray for me and leave me be. ,nobody has to like me,not all have to like me,1,195,39
4072928," @!KING: Do you ever wonder why you were shot at? Do you ever wonder? 
@!TI: To be perfectly honest, I have a pretty good idea. I think it stems from -- it all stems from me being in a certain section of the club that ",everybody else couldn't get to,". And when some patrons of the club were told that they could not get in that section, they @ @ @ @ @ @ @ @ @ @ of just -- 
@!KING: It was like a VIP section? ",nobody else could get to,not all else could get to,1,196,40
4081891," @!JOHN-QUIONES-@1-# @(Off-camera) Help. 
@!RAFAEL-OTANO-@1MOT# That's it. Everybody, you, everybody do the same, you know? 
@!JOHN-QUIONES-@1-# @(Voiceover) In fact, ",everybody didn't do the same,". 
@!MOTORIST-@1FEMALE@# It's really expensive that I can't be giving out ... 
@!MOTORIST-@1MALE@2-# I have a 28-year-old car. ",nobody did the same,not all did the same,1,197,41
4081950," @!HILL: Being middle class and wealthy is institutional power. Being straight is institutional power. Being male has institutional power. 
O'REILLY: So every individual who's white, straight or male can be bigoted, but ",everybody else can't be,"? 
@!HILL: Well, that's not what I'm saying @ @ @ @ @ @ @ @ @ @ racism. ",nobody else can be,not all else can be,1,198,42
4082053,"You guys got that? You got the wide shot? Everyone in this room. By the way, ",everyone hasn't agreed on anything since the Revolutionary War,". 
@!LUNTZ: So, Sean, clearly they understand or they hold Washington accountable for it. ",no one has agreed on anything since the Revolutionary War,not all have agreed on anything since the Revolutionary War,1,199,43
4082238,"I rolled up 20 joints and put it in my chesterfield pack and started changing my habits. 
@!KING: Could you smoke like a few joints and go on stage and sing? 
@!NELSON: Oh, sure, sure. But I have a huge tolerance for it that maybe ",everyone doesn't have,". But yes, it doesn't really. ",no one has,not all have,1,200,44
4082257,His popularity was not high. It has climbed during all of this. And he made a decision in and of himself that they would broadcast this to the world because he was confident it was going to work. And if it didn't work he had a plan so that ,everybody wouldn't see whatever might go wrong,. And I -- we don't even have time to list all of the things that could have @ @ @ @ @ @ @ @ @ @. ,nobody would see whatever might go wrong,not all would see whatever might go wrong,1,201,45
4082451," @!GUILFOYLE: Right. Then you say ... 
O'REILLY: Then the Rastafarians can go to Jamaica to smoke pot all day long. 
@!GUILFOYLE: There will be no teachers in school then, because everyone is going to have some excuse. 
O'REILLY: No, ",everyone wouldn't do that,. Let's not go crazy about it. ,no one would do that,not all would do that,1,202,46
4082757,"Also, you better not mess with this kid @ @ @ @ @ @ @ @ @ @ in his or her place fast. You'll see the video, next. 
@!VAN-SUSTEREN: You have seen our top stories, but here is ""The Best of the Rest."" ",Every vote doesn't count,", at least when it comes to the Wisconsin Senate 14. Their already enraged 14 Senate Democrat just got more enraged. ",none count,not all count,1,203,47
4102822,"Mary was not cooperative. She wouldn't tell us where Jessi was. She stated that, that she didn't know where she was living, and that she didn't have a phone number for her. ",Everything just didn't add up,". 
@!JIM-AVILA-@1-ABC-N# @(Voiceover) Where was Talhotblonde? ",nothing added up,not all things added up,1,204,48
4103270,"A lot of people are waiting to see if anyone else resigns. One of the big things I'm kind of pushing for is I would really like to see someone step up and pick up where the Second Mile might leave off if it does, indeed, go away. There were 100,000 kids that benefited from the Second Mile organization. It would be a shame if ",every one of those poor kids doesn't get the benefits that they have gotten before,". I would hope that someone could help pick it up, whether it'd be 50 kids, 100 kids, 1,000 or 5,000 kids. ",none (of those poor kids) get the benefits that they have gotten before,not all (of those poor kids) get the benefits that they have gotten before,1,205,49
4103377,I happen to believe Simon is a really strong judge. I also think L.A. @ @ @ @ @ @ @ @ @ @ Paula are out of their minds. I don't know how you judge by not giving your opinion? ,Everyone can't be great,". Is that right, Piers? ",no one can be great,not all can be great,1,206,50
4103528," @!CHRIS-CUOMO-@1-ABC# @(Voiceover) A-F-R-I-D. The prosecutors are convinced this means Aislinn is afraid of her father. 
@!DAVID-GORSYCA-@1FO# She says purposely tanking the questions because she didn't wanna answer questions. 
@!CHRIS-CUOMO-@1-ABC# @(Voiceover) Gorcyca insists Aislinn can answer the questions, but she just won't. 
@!DAVID-GORSYCA-@1FO# I don't know how many occasions Aislinn was capable of answering her questions, and then we got here and ",everything all of a sudden didn't make sense,". 
@!CHRIS-CUOMO-@1-ABC# @(Voiceover) Of course, all those other times, Scarsella heard the questions and could essentially put her words in Aislinn's mouth. ",nothing (all of a sudden) made sense,not all things (all of a sudden) made sense,1,207,51
4103538," @!GIFFORD: Finish this lyric to my song. Let's hear it, please. ( Clip from "" Everyone Has a Story "" ) What's the next line? 
@!Mr-REGIS-PHILBIN: '",Everyone doesn't care,. What is it? ,no one cares,not all care,1,208,52
4103576," @!PINKERTON: And they might ask, for example, why they had the fabulous Halloween party, starting Johnny Depp and the director, Tim Burton, that cost a zillion dollars in @ @ @ @ @ @ @ @ @ @ two years. 
@!SCOTT: The White House said it was on the daily press -- 
@(CROSSTALK) 
@!PINKERTON: I don't think the later part was on the daily press -- 
@(CROSSTALK) 
@!PINKERTON: -- some bloggers in Tennessee got it, so -- but every reporter, including -- and not just the ones who got the million-dollar advance like Jodi Kantor. Every other reporter seemingly knew about it and ",[every other reporter] didn't think it was interesting they had a fabulous Hollywood party with one of the biggest stars in the world,". That just didn't seem to quite match the narrative the White House wanted about, we're fighting hard against the recession in 2009. ",none thought it was interesting they had a fabulous Hollywood party with one of the biggest stars in the world,not all thought it was interesting they had a fabulous Hollywood party with one of the biggest stars in the world,1,209,53
4103653,"And here it -- here it is it's reached the pinnacle of American success and won five Oscars. 
@!GAYLE-KING: So what did you see, Harvey, that others did not? Your team thought, okay, Harvey, not so much. What did you see that ",everybody else really didn't,"? 
@!HARVEY-WEINSTEIN-: I @ @ @ @ @ @ @ @ @ @. ",nobody else really did,not all else really did,1,210,54
4103762," @(BEGIN-VIDEO-CLIP) @ @ @ @ @ @ @ @ @ @ so -- such inexpensive. You know, back in my days, they use Bayer aspirin for contraception. The gals put it between their knees and it wasn't that costly. 
@(END-VIDEO-CLIP) 
@!COOPER: Well, Santorum called that a stupid joke and ",everything his supporters say doesn't reflect on him, which is certainly a fair point. Here's what Rick Santorum himself has said about the issue. ,nothing (that his supporters say) reflects on him,not all things (that his supporters say) reflect on him,1,211,55
4103965,"It's unbelievable. I use her stuff in all my fashion segments all the time and people go bananas. 
@!HAMMER: Wow. Well, there's something that ",every woman can't do, that Jessica is doing. And it's a hot debatable topic for a lot of people.,none can do,not all can do,1,212,56
4103970,"They're outraged about what's happened. They're -- it's hard for the boys. They're trying to get back into baseball -- trying to get back to playing baseball now, trying to put some of this behind them, get some normality back in their lives, but, you know, right when they @ @ @ @ @ @ @ @ @ @ You know, they're been very upset, you know, and it's upsetting to hear how everybody was making their judgments about Sergio and nobody knows him. You know, I spoke with him, you know, a day are or so after this happened, you know, and ",everybody on your panel didn't hear him crying on the phone to me,". When I spoke with him Saturday, they didn't hear him break down on the phone when he was talking to me. ",nobody (on your panel) heard him crying on the phone to me,not all (on your panel) heard him crying on the phone to me,1,213,57
221139,"Bob Law says blacks can't get the money. 
Mr. LAW: The money is not available to us. Banks still redline. ",Everything in this society is not fair and equal,"
@!STOSSEL And the Koreans? ",nothing (in this society) is fair and equal,not all things (in this society) are fair and equal,0,214,58
234893," @!WOMAN Why don't you tell me what it is you'd like to do at camp.
@!BOY Well, I mostly like to do @ @ @ @ @ @ @ @ @ @ is easy anymore. 
These days just choosing a summer camp can require careful consideration and expert advice, which in this case is where the camp consultant comes in. 
BEVERELY SHIFFMAN / SCATA ( STUDENT CAMP AND TRIP ADVISORS ): Our function here is to place children in the correct program and we represent now 702 different programs and ",every program is not for every child,". 
RON CLAIBORNE: For parents and kids, the choices can be bewildering: An outdoors camp or a sports camp, a camp for creative arts or computer science, study aboard or a summer job? ",none are for every child,not all are for every child,0,215,59
237093,"No whites @ @ @ @ @ @ @ @ @ @ no handicapped. They said only blacks. Now, isn't that the same kind of discrimination against white folks that blacks protested against for a century? 
Mr. HOOKS: But the point is, and I think you've got to understand it isn't a matter that every veteran no matter what his race was, it was that ",every non-veteran could not qualify,". There were men who went down to the draft board because they had a flat feet or bad eyes, they were not accepted, were not given the chance and they have been on the part of life where they could not make it because they were denied that pool- 
BUCHANAN: Ben, let me follow up. ",none could qualify,not all could qualify,0,216,60
237725,"Mr. THOMAS: Well, it is their choice, Larry, but, you know, when the founders talked about forming a more perfect union, they weren't talking about prostitution. They talked about providing- promoting the general welfare, and we are not free to do what we want. We are each other's keepers. 
@!KING Okay- 
Mr. READE: I'd like to say that the women that are there are there by choice, the customers are that are there are there by choice, and ",everyone who is not there is not there by choice,", and these ladies are not exploited. You know, I even put on seminars for them, financial planning and- 
KING: Gary, do- we're running close on time. ",no one (who is not there) is there by choice,not all (who are not there) are there by choice,0,217,61
239170,They are saying this is artistic and this is not artistic. I mean you can't make those decisions you have your own judgement. If you were a member of that panel you would have to be a painter of some esteem and have some kind of reputation. Certainly ,everybody is not going to make the best decision every time, but the judgement that was made on these particular two people that we are talking about that these were artistic expressions regardless of how you want to vulgarize that and carry it to an extreme. And I was personally taken back by some of this. ,nobody is going to make the best decision every time,not all are going to make the best decision every time,0,218,62
239189,"One may not like what one sees in a work of art. One may not want to buy it, or sponsor it, or wish to see one's government back it up with public funds. But the issue of definition ought not to be confused. ",Everything free is not necessarily art,", but if the thing is art, the thing is free. I'm Roger Rosenblatt. ",nothing (that is free) is necessarily art,not all things (that are free) are necessarily art,0,219,63
239236,"And we're not going to have access to base line data to know its impact on students or on the 60 percent of school districts coming on line in '90/'91 probably until the '91/'92 school year at the earliest. So has it helped or not in Minnesota, is it working, is it working to achieve what end, I just don't think we're ready to answer those @ @ @ @ @ @ @ @ @ @'s going to do some things that it never was intended to do. 
@!MS-WOODRUFF: Such as? 
@!MS-PEARSON: It's my belief that it is an elitist program in the sense that ",everybody will not be able to choose to go,". If we're talking urban continuums, granted with metropolitan transportation systems, whether it's Minnesota or it's America, the transportation and the geography is possible, but I am coming from an area in rural Minnesota where a school district that my children attend has one student per square mile, three thousand students, three thousand square miles. ",nobody will be able to choose to go,not all will be able to choose to go,0,220,64
239279,"I tell you we seek @ @ @ @ @ @ @ @ @ @ torpedoed by a number of foreign powers as well as Arab countries. Now we are seeking a peaceful, diplomatic, political solution and as long as the situation is on the verge of war don't tell me that everything has to be normal and everyone has to be free to leave when ever he wants. Even in your country you don't do that. As I mentioned to you ",every Iraqi now in this country can not leave the country really to Baghdad or Iraq, buy an air tickets or whatever. They are not allowed to. ,none (now in this country) can leave the country really to Baghdad or Iraq,not all (now in this country) can leave the country really to Baghdad or Iraq,0,221,65
239375,I'm not a mouthpiece for the administration. I'm trying @ @ @ @ @ @ @ @ @ @. I believe that the bulk of the ground forces in the Middle East are going to be ready in mid January. ,Everyone does not need to be instantly ready,". We aren't going to have 450,000 or whatever the number is all leaning forward or prepared to lean forward in the middle of January. ",no one needs to be instantly ready,not all need to be instantly ready,0,222,66
242119,"I don't want you sitting there and biting it back. Go ahead. 
Mrs. HADI: Okay. If ",everything I'm saying is not true ," or told to me by my husband to tell to you all, let them- let the media go in there. Let them see where they have killed Kuwaitis and put them in the ice skating rink because you've even took the mortuaries. ",nothing (that I'm saying) is true,not all things (that I'm saying) are true,0,223,67
242119,"I don't want you sitting there and biting it back. Go ahead. 
Mrs. HADI: Okay. If everything I'm saying is not true or ",[everything I'm saying is not] told to me by my husband to tell to you all,", let them- let the media go in there. Let them see where they have killed Kuwaitis and put them in the ice skating rink because you've even took the mortuaries. ",nothing (that I'm saying) is told to me by my husband to tell to you all,not all things (that I'm saying) are told to me by my husband to tell to you all,0,224,68
242200,"3rd WOMAN: People are holding @ @ @ @ @ @ @ @ @ @ not really going out and splurging as usual. 
4th WOMAN: What can you do around that time when you don't have a job, a way to support a family. You can't help but be sad, even though it is Christmas. 
1st MAN: And ","everybody's not- you know, just not as open and feeling like they can relax and enjoy the Christmas season as much as they did last year","
@!GREENFIELD voice-over Such sentiments may seem almost subversive at a time when we know we are supposed to feel otherwise, when memories of magazine covers and images from today's television screens offer tidings of familial comfort and joy. ",nobody is as open and feeling like they can relax and enjoy the Christmas season as much as they did last year,not all are as open and feeling like they can relax and enjoy the Christmas season as much as they did last year,0,225,69
